A-1: Song's Name: | B-1: Entry Name: | C-1: CCC | D-1: Tenshi | E-1: Ensyther | F-1: Ollec | G-1: BASE | H-1: Format | I-1: Genre | J-1: TB | K-1: Sway | L-1: Final Score
A0: Just Like Naoki | B0: Eric Ruth | C0: 64 | D0: 67 | E0: 69 | F0: 64 | G0: =AVERAGE(C2:F2) -> 66 | H0: 9 | I0: 5 | J0: 5 | K0: 15 | L0: =SUM(G2:K2) -> 100
A1: Domo Domo Domo (KCP Remix) | B1: Titiln | C1: 68 | D1: 69 | E1: 66 | F1: 69 | G1: =AVERAGE(C3:F3) -> 68 | H1: 10 | I1: 0 | J1: 5 | K1: 15 | L1: =SUM(G3:K3) -> 98
A2: Roppongi Carillon | B2: KingKirby87 | C2: 66 | D2: 73 | E2: 72 | F2: 69 | G2: =AVERAGE(C4:F4) -> 70 | H2: 10 | I2: 0 | J2: 3 | K2: 15 | L2: =SUM(G4:K4) -> 98
A3: Give it to me Baby | B3: spriggan72 | C3: 71 | D3: 71 | E3: 59 | F3: 65 | G3: =AVERAGE(C5:F5) -> 66.5 | H3: 10 | I3: 0 | J3: 3 | K3: 15 | L3: =SUM(G5:K5) -> 94.5
A4: You Spin Me 'Round (remix) | B4: DJ Drafthorse | C4: 68 | D4: 67 | E4: 63 | F4: 68 | G4: =AVERAGE(C6:F6) -> 66.5 | H4: 9 | I4: 0 | J4: 4 | K4: 15 | L4: =SUM(G6:K6) -> 94.5
A5: Clubstepper (Club Mix) | B5: VF | C5: 70 | D5: 68 | E5: 54 | F5: 63 | G5: =AVERAGE(C7:F7) -> 63.75 | H5: 9 | I5: 0 | J5: 4 | K5: 15 | L5: =SUM(G7:K7) -> 91.75
A6: Let Me Take Your Heart | B6: ecureuil | C6: 58 | D6: 70 | E6: 54 | F6: 66 | G6: =AVERAGE(C8:F8) -> 62 | H6: 10 | I6: 0 | J6: 3 | K6: 15 | L6: =SUM(G8:K8) -> 90
A7: Malchik Gey | B7: Arcanyx | C7: 58 | D7: 66 | E7: 58 | F7: 64 | G7: =AVERAGE(C9:F9) -> 61.5 | H7: 10 | I7: 0 | J7: 3 | K7: 15 | L7: =SUM(G9:K9) -> 89.5
A8: Can't Get you Out of my head | B8: twen | C8: 67 | D8: 59 | E8: 60 | F8: 64 | G8: =AVERAGE(C10:F10) -> 62.5 | H8: 9 | I8: 0 | J8: 5 | K8: 11 | L8: =SUM(G10:K10) -> 87.5
A9: Captain Jack | B9: pokecapn | C9: 61 | D9: 64 | E9: 54 | F9: 59 | G9: =AVERAGE(C11:F11) -> 59.5 | H9: 10 | I9: 0 | J9: 5 | K9: 13 | L9: =SUM(G11:K11) -> 87.5
A10: Green Hill (Euroclub '95 Mix) | B10: jammitch | C10: 61 | D10: 71 | E10: 57 | F10: 71 | G10: =AVERAGE(C12:F12) -> 65 | H10: 10 | I10: 0 | J10: 4 | K10: 6 | L10: =SUM(G12:K12) -> 85
A11: Beethoven 5th | B11: Xidane | C11: 56 | D11: 64 | E11: 63 | F11: 58 | G11: =AVERAGE(C13:F13) -> 60.25 | H11: 9 | I11: 0 | J11: 3 | K11: 12 | L11: =SUM(G13:K13) -> 84.25
A12: Love Is In Danger | B12: Vyse | C12: 64 | D12: 68 | E12: 54 | F12: 67 | G12: =AVERAGE(C14:F14) -> 63.25 | H12: 10 | I12: 0 | J12: 4 | K12: 4 | L12: =SUM(G14:K14) -> 81.25
G13: =AVERAGE(C15:F15) ->  | L13: =SUM(G15:K15) -> 
G14: =AVERAGE(C15:F15) ->  | L14: =SUM(G15:K15) -> 
A15: Jumpin | B15: Dj KoZoTo | C15: 62 | D15: 68 | E15: 59 | F15: 66 | G15: =AVERAGE(C15:F15) -> 63.75 | H15: 9 | I15: 0 | J15: 3 | K15: 3 | L15: =SUM(G15:K15) -> 78.75
A16: Bean Victory | B16: Jaik | C16: 54 | D16: 68 | E16: 51 | F16: 59 | G16: =AVERAGE(C16:F16) -> 58 | H16: 9 | I16: 0 | J16: 4 | K16: 7 | L16: =SUM(G16:K16) -> 78
A17: Little Mac's Confession | B17: RTF | C17: 53 | D17: 65 | E17: 62 | F17: 48 | G17: =AVERAGE(C17:F17) -> 57 | H17: 10 | I17: 0 | J17: 3 | K17: 8 | L17: =SUM(G17:K17) -> 78
A18: %5' | B18: Funbox | C18: 57 | D18: 60 | E18: 47 | F18: 61 | G18: =AVERAGE(C18:F18) -> 56.25 | H18: 8 | I18: 0 | J18: 5 | K18: 8 | L18: =SUM(G18:K18) -> 77.25
A19: Felys | B19: MaftaXD | C19: 57 | D19: 61 | E19: 54 | F19: 52 | G19: =AVERAGE(C19:F19) -> 56 | H19: 9 | I19: 0 | J19: 1 | K19: 10 | L19: =SUM(G19:K19) -> 76
A20: Get Ready For This | B20: CatchRothy22 | C20: 55 | D20: 70 | E20: 59 | F20: 56 | G20: =AVERAGE(C20:F20) -> 60 | H20: 9 | I20: 0 | J20: 2 | K20: 4 | L20: =SUM(G20:K20) -> 75
A21: Free Like The Wind (Party Remix) | B21: PenguinMan | C21: 58 | D21: 69 | E21: 60 | F21: 52 | G21: =AVERAGE(C21:F21) -> 59.75 | H21: 8 | I21: 0 | J21: 4 | K21: 2 | L21: =SUM(G21:K21) -> 73.75
A22: Lunar: The Silver Star (Opening Theme) | B22: Adelor | C22: 58 | D22: 60 | E22: 53 | F22: 53 | G22: =AVERAGE(C22:F22) -> 56 | H22: 9 | I22: 0 | J22: 4 | K22: 4 | L22: =SUM(G22:K22) -> 73
A23: Harder, Better, Faster, Stronger | B23: MyriadOfShades | C23: 47 | D23: 64 | E23: 53 | F23: 50 | G23: =AVERAGE(C23:F23) -> 53.5 | H23: 7 | I23: 0 | J23: 3 | K23: 9 | L23: =SUM(G23:K23) -> 72.5
A24: Cool City | B24: Mega | C24: 53 | D24: 67 | E24: 47 | F24: 54 | G24: =AVERAGE(C24:F24) -> 55.25 | H24: 10 | I24: 0 | J24: 3 | K24: 4 | L24: =SUM(G24:K24) -> 72.25
A25: CHRONOLOGIE IV | B25: Wellian | C25: 51 | D25: 65 | E25: 60 | F25: 62 | G25: =AVERAGE(C25:F25) -> 59.5 | H25: 10 | I25: 0 | J25: 0 | K25: 2 | L25: =SUM(G25:K25) -> 71.5
A26: 12:00N | B26: Kurisu | C26: 55 | D26: 57 | E26: 53 | F26: 56 | G26: =AVERAGE(C26:F26) -> 55.25 | H26: 9 | I26: 0 | J26: 5 | K26: 2 | L26: =SUM(G26:K26) -> 71.25
A27: Gotta Get My Groove On | B27: Xythar | C27: 59 | D27: 62 | E27: 53 | F27: 60 | G27: =AVERAGE(C27:F27) -> 58.5 | H27: 10 | I27: -4 | J27: 4 | K27: 2 | L27: =SUM(G27:K27) -> 70.5
A28: Angel (Euromix) | B28: Dancilancilism | C28: 59 | D28: 65 | E28: 44 | F28: 40 | G28: =AVERAGE(C28:F28) -> 52 | H28: 9 | I28: 0 | J28: 0 | K28: 9 | L28: =SUM(G28:K28) -> 70
A29: Love & Extasy | B29: NVLMTraX | C29: 56 | D29: 66 | E29: 49 | F29: 66 | G29: =AVERAGE(C29:F29) -> 59.25 | H29: 8 | I29: 0 | J29: 0 | K29: 2 | L29: =SUM(G29:K29) -> 69.25
A30: INSANE ASYLUM | B30: TheCzechitalian | C30: 56 | D30: 65 | E30: 45 | F30: 51 | G30: =AVERAGE(C30:F30) -> 54.25 | H30: 8 | I30: 0 | J30: 0 | K30: 6 | L30: =SUM(G30:K30) -> 68.25
A31: It's my Life | B31: GoGoNaoki | C31: 55 | D31: 64 | E31: 51 | F31: 45 | G31: =AVERAGE(C31:F31) -> 53.75 | H31: 9 | I31: 0 | J31: 1 | K31: 3 | L31: =SUM(G31:K31) -> 66.75
A32: Freezing Atmosphere | B32: Crza | C32: 53 | D32: 65 | E32: 59 | F32: 55 | G32: =AVERAGE(C32:F32) -> 58 | H32: 9 | I32: -5 | J32: 3 | K32: 1 | L32: =SUM(G32:K32) -> 66
A33: Clash on the Big Bridge | B33: Shin | C33: 46 | D33: 56 | E33: 51 | F33: 40 | G33: =AVERAGE(C33:F33) -> 48.25 | H33: 9 | I33: 0 | J33: 2 | K33: 6 | L33: =SUM(G33:K33) -> 65.25
A34: Catastrophic Cognitive Void | B34: CAdam | C34: 45 | D34: 55 | E34: 43 | F34: 52 | G34: =AVERAGE(C34:F34) -> 48.75 | H34: 8 | I34: 5 | J34: 3 | K34: 0 | L34: =SUM(G34:K34) -> 64.75
A35: Lifesupport | B35: roothorick | C35: 50 | D35: 66 | E35: 44 | F35: 43 | G35: =AVERAGE(C35:F35) -> 50.75 | H35: 9 | I35: 0 | J35: 0 | K35: 4 | L35: =SUM(G35:K35) -> 63.75
A36: chaos mkII | B36: CPi | C36: 37 | D36: 57 | E36: 43 | F36: 39 | G36: =AVERAGE(C36:F36) -> 44 | H36: 9 | I36: 5 | J36: 5 | K36: 0 | L36: =SUM(G36:K36) -> 63
A37: Do Wah Diddy | B37: Tekara Asagiri | C37: 43 | D37: 47 | E37: 46 | F37: 42 | G37: =AVERAGE(C37:F37) -> 44.5 | H37: 8 | I37: 0 | J37: 5 | K37: 0 | L37: =SUM(G37:K37) -> 57.5
A38: Jakkety Sax (The Benny Hill Theme) | B38: Simon X | C38: 48 | D38: 36 | E38: 34 | F38: 35 | G38: =AVERAGE(C38:F38) -> 38.25 | H38: 10 | I38: 0 | J38: 5 | K38: 1 | L38: =SUM(G38:K38) -> 54.25
A39: Death Machine | B39: Shadowman | C39: 26 | D39: 37 | E39: 31 | F39: 32 | G39: =AVERAGE(C39:F39) -> 31.5 | H39: 9 | I39: 0 | J39: 5 | K39: 3 | L39: =SUM(G39:K39) -> 48.5
A40: GO!!! ~NARUTO OPENING MIX~ | B40: DRM3 | C40: 29 | D40: 26 | E40: 28 | F40: 36 | G40: =AVERAGE(C40:F40) -> 29.75 | H40: 7 | I40: 0 | J40: 5 | K40: 2 | L40: =SUM(G40:K40) -> 43.75
A41: DNA | B41: klonoa-3663 | C41: 44 | D41: 61 | E41: 43 | F41: 34 | G41: =AVERAGE(C41:F41) -> 45.5 | H41: 9 | I41: 0 | J41: -20 | K41: 8 | L41: =SUM(G41:K41) -> 42.5
A42: Battle Without Honor Or Humaity | B42: Sambo | C42: 18 | D42: 28 | E42: 13 | F42: 7 | G42: =AVERAGE(C42:F42) -> 16.5 | H42: 8 | I42: 0 | J42: 1 | K42: 3 | L42: =SUM(G42:K42) -> 28.5
A43: Heart of Sword (B.D. Remix) | B43: Whatisthematrix | C43: 25 | D43: 23 | E43: 24 | F43: 20 | G43: =AVERAGE(C43:F43) -> 23 | H43: 6 | I43: 0 | J43: -20 | K43: 0 | L43: =SUM(G43:K43) -> 9