A1: Song's Name: | B1: Entry Name: | C1: CCC | D1: Tenshi | E1: Ensyther | F1: Ollec | G1: Average | H1: Format | I1: BASE | J1: Genre | K1: TB | L1: Sway | M1: Final Score
A2: Just Like Naoki | B2: Eric Ruth | C2: 64 | D2: 67 | E2: 69 | F2: 64 | G2: =AVERAGE(C2:F2) -> 66 | H2: 9 | I2: =SUM(G2:H2) -> 75 | J2: 5 | K2: 5 | L2: 15 | M2: =SUM(I2:L2) -> 100
A4: Roppongi Carillon | B4: KingKirby87 | C4: 66 | D4: 73 | E4: 72 | F4: 69 | G4: =AVERAGE(C4:F4) -> 70 | H4: 10 | I4: =SUM(G4:H4) -> 80 | J4: 0 | K4: 3 | L4: 15 | M4: =SUM(I4:L4) -> 98
A5: Domo Domo Domo (KCP Remix) | B5: Titiln | C5: 68 | D5: 69 | E5: 66 | F5: 69 | G5: =AVERAGE(C5:F5) -> 68 | H5: 10 | I5: =SUM(G5:H5) -> 78 | J5: 0 | K5: 5 | L5: 15 | M5: =SUM(I5:L5) -> 98
A6: Give it to me Baby | B6: spriggan72 | C6: 71 | D6: 71 | E6: 59 | F6: 65 | G6: =AVERAGE(C6:F6) -> 66.5 | H6: 10 | I6: =SUM(G6:H6) -> 76.5 | J6: 0 | K6: 3 | L6: 15 | M6: =SUM(I6:L6) -> 94.5
A7: You Spin Me 'Round (remix) | B7: DJ Drafthorse | C7: 68 | D7: 67 | E7: 63 | F7: 68 | G7: =AVERAGE(C7:F7) -> 66.5 | H7: 9 | I7: =SUM(G7:H7) -> 75.5 | J7: 0 | K7: 4 | L7: 15 | M7: =SUM(I7:L7) -> 94.5
A8: Clubstepper (Club Mix) | B8: VF | C8: 70 | D8: 68 | E8: 54 | F8: 63 | G8: =AVERAGE(C8:F8) -> 63.75 | H8: 9 | I8: =SUM(G8:H8) -> 72.75 | J8: 0 | K8: 4 | L8: 15 | M8: =SUM(I8:L8) -> 91.75
A9: Let Me Take Your Heart | B9: ecureuil | C9: 58 | D9: 70 | E9: 54 | F9: 66 | G9: =AVERAGE(C9:F9) -> 62 | H9: 10 | I9: =SUM(G9:H9) -> 72 | J9: 0 | K9: 3 | L9: 15 | M9: =SUM(I9:L9) -> 90
A11: Malchik Gey | B11: Arcanyx | C11: 58 | D11: 66 | E11: 58 | F11: 64 | G11: =AVERAGE(C11:F11) -> 61.5 | H11: 10 | I11: =SUM(G11:H11) -> 71.5 | J11: 0 | K11: 3 | L11: 15 | M11: =SUM(I11:L11) -> 89.5
A12: Can't Get you Out of my head | B12: twen | C12: 67 | D12: 59 | E12: 60 | F12: 64 | G12: =AVERAGE(C12:F12) -> 62.5 | H12: 9 | I12: =SUM(G12:H12) -> 71.5 | J12: 0 | K12: 5 | L12: 11 | M12: =SUM(I12:L12) -> 87.5
A13: Captain Jack | B13: pokecapn | C13: 61 | D13: 64 | E13: 54 | F13: 59 | G13: =AVERAGE(C13:F13) -> 59.5 | H13: 10 | I13: =SUM(G13:H13) -> 69.5 | J13: 0 | K13: 5 | L13: 13 | M13: =SUM(I13:L13) -> 87.5
A14: Green Hill (Euroclub '95 Mix) | B14: jammitch | C14: 61 | D14: 71 | E14: 57 | F14: 71 | G14: =AVERAGE(C14:F14) -> 65 | H14: 10 | I14: =SUM(G14:H14) -> 75 | J14: 0 | K14: 4 | L14: 6 | M14: =SUM(I14:L14) -> 85
A15: Beethoven 5th | B15: Xidane | C15: 56 | D15: 64 | E15: 63 | F15: 58 | G15: =AVERAGE(C15:F15) -> 60.25 | H15: 9 | I15: =SUM(G15:H15) -> 69.25 | J15: 0 | K15: 3 | L15: 12 | M15: =SUM(I15:L15) -> 84.25
A16: Love Is In Danger | B16: Vyse | C16: 64 | D16: 68 | E16: 54 | F16: 67 | G16: =AVERAGE(C16:F16) -> 63.25 | H16: 10 | I16: =SUM(G16:H16) -> 73.25 | J16: 0 | K16: 4 | L16: 4 | M16: =SUM(I16:L16) -> 81.25
A18: Jumpin | B18: Dj KoZoTo | C18: 62 | D18: 68 | E18: 59 | F18: 66 | G18: =AVERAGE(C18:F18) -> 63.75 | H18: 9 | I18: =SUM(G18:H18) -> 72.75 | J18: 0 | K18: 3 | L18: 3 | M18: =SUM(I18:L18) -> 78.75
A19: Bean Victory | B19: Jaik | C19: 54 | D19: 68 | E19: 51 | F19: 59 | G19: =AVERAGE(C19:F19) -> 58 | H19: 9 | I19: =SUM(G19:H19) -> 67 | J19: 0 | K19: 4 | L19: 7 | M19: =SUM(I19:L19) -> 78
A20: Little Mac's Confession | B20: RTF | C20: 53 | D20: 65 | E20: 62 | F20: 48 | G20: =AVERAGE(C20:F20) -> 57 | H20: 10 | I20: =SUM(G20:H20) -> 67 | J20: 0 | K20: 3 | L20: 8 | M20: =SUM(I20:L20) -> 78
A21: %5' | B21: Funbox | C21: 57 | D21: 60 | E21: 47 | F21: 61 | G21: =AVERAGE(C21:F21) -> 56.25 | H21: 8 | I21: =SUM(G21:H21) -> 64.25 | J21: 0 | K21: 5 | L21: 8 | M21: =SUM(I21:L21) -> 77.25
A22: Felys | B22: MaftaXD | C22: 57 | D22: 61 | E22: 54 | F22: 52 | G22: =AVERAGE(C22:F22) -> 56 | H22: 9 | I22: =SUM(G22:H22) -> 65 | J22: 0 | K22: 1 | L22: 10 | M22: =SUM(I22:L22) -> 76
A23: Get Ready For This | B23: CatchRothy22 | C23: 55 | D23: 70 | E23: 59 | F23: 56 | G23: =AVERAGE(C23:F23) -> 60 | H23: 9 | I23: =SUM(G23:H23) -> 69 | J23: 0 | K23: 2 | L23: 4 | M23: =SUM(I23:L23) -> 75
A24: Free Like The Wind (Party Remix) | B24: PenguinMan | C24: 58 | D24: 69 | E24: 60 | F24: 52 | G24: =AVERAGE(C24:F24) -> 59.75 | H24: 8 | I24: =SUM(G24:H24) -> 67.75 | J24: 0 | K24: 4 | L24: 2 | M24: =SUM(I24:L24) -> 73.75
A25: Lunar: The Silver Star (Opening Theme) | B25: Adelor | C25: 58 | D25: 60 | E25: 53 | F25: 53 | G25: =AVERAGE(C25:F25) -> 56 | H25: 9 | I25: =SUM(G25:H25) -> 65 | J25: 0 | K25: 4 | L25: 4 | M25: =SUM(I25:L25) -> 73
A26: Harder, Better, Faster, Stronger | B26: MyriadOfShades | C26: 47 | D26: 64 | E26: 53 | F26: 50 | G26: =AVERAGE(C26:F26) -> 53.5 | H26: 7 | I26: =SUM(G26:H26) -> 60.5 | J26: 0 | K26: 3 | L26: 9 | M26: =SUM(I26:L26) -> 72.5
A27: Cool City | B27: Mega | C27: 53 | D27: 67 | E27: 47 | F27: 54 | G27: =AVERAGE(C27:F27) -> 55.25 | H27: 10 | I27: =SUM(G27:H27) -> 65.25 | J27: 0 | K27: 3 | L27: 4 | M27: =SUM(I27:L27) -> 72.25
A28: CHRONOLOGIE IV | B28: Wellian | C28: 51 | D28: 65 | E28: 60 | F28: 62 | G28: =AVERAGE(C28:F28) -> 59.5 | H28: 10 | I28: =SUM(G28:H28) -> 69.5 | J28: 0 | K28: 0 | L28: 2 | M28: =SUM(I28:L28) -> 71.5
A29: 12:00N | B29: Kurisu | C29: 55 | D29: 57 | E29: 53 | F29: 56 | G29: =AVERAGE(C29:F29) -> 55.25 | H29: 9 | I29: =SUM(G29:H29) -> 64.25 | J29: 0 | K29: 5 | L29: 2 | M29: =SUM(I29:L29) -> 71.25
A30: Gotta Get My Groove On | B30: Xythar | C30: 59 | D30: 62 | E30: 53 | F30: 60 | G30: =AVERAGE(C30:F30) -> 58.5 | H30: 10 | I30: =SUM(G30:H30) -> 68.5 | J30: -4 | K30: 4 | L30: 2 | M30: =SUM(I30:L30) -> 70.5
A31: Angel (Euromix) | B31: Dancilancilism | C31: 59 | D31: 65 | E31: 44 | F31: 40 | G31: =AVERAGE(C31:F31) -> 52 | H31: 9 | I31: =SUM(G31:H31) -> 61 | J31: 0 | K31: 0 | L31: 9 | M31: =SUM(I31:L31) -> 70
A32: Love & Extasy | B32: NVLMTraX | C32: 56 | D32: 66 | E32: 49 | F32: 66 | G32: =AVERAGE(C32:F32) -> 59.25 | H32: 8 | I32: =SUM(G32:H32) -> 67.25 | J32: 0 | K32: 0 | L32: 2 | M32: =SUM(I32:L32) -> 69.25
A33: INSANE ASYLUM | B33: TheCzechitalian | C33: 56 | D33: 65 | E33: 45 | F33: 51 | G33: =AVERAGE(C33:F33) -> 54.25 | H33: 8 | I33: =SUM(G33:H33) -> 62.25 | J33: 0 | K33: 0 | L33: 6 | M33: =SUM(I33:L33) -> 68.25
A34: It's my Life | B34: GoGoNaoki | C34: 55 | D34: 64 | E34: 51 | F34: 45 | G34: =AVERAGE(C34:F34) -> 53.75 | H34: 9 | I34: =SUM(G34:H34) -> 62.75 | J34: 0 | K34: 1 | L34: 3 | M34: =SUM(I34:L34) -> 66.75
A35: Freezing Atmosphere | B35: Crza | C35: 53 | D35: 65 | E35: 59 | F35: 55 | G35: =AVERAGE(C35:F35) -> 58 | H35: 9 | I35: =SUM(G35:H35) -> 67 | J35: -5 | K35: 3 | L35: 1 | M35: =SUM(I35:L35) -> 66
A36: Clash on the Big Bridge | B36: Shin | C36: 46 | D36: 56 | E36: 51 | F36: 40 | G36: =AVERAGE(C36:F36) -> 48.25 | H36: 9 | I36: =SUM(G36:H36) -> 57.25 | J36: 0 | K36: 2 | L36: 6 | M36: =SUM(I36:L36) -> 65.25
A37: Catastrophic Cognitive Void | B37: CAdam | C37: 45 | D37: 55 | E37: 43 | F37: 52 | G37: =AVERAGE(C37:F37) -> 48.75 | H37: 8 | I37: =SUM(G37:H37) -> 56.75 | J37: 5 | K37: 3 | L37: 0 | M37: =SUM(I37:L37) -> 64.75
A38: Lifesupport | B38: roothorick | C38: 50 | D38: 66 | E38: 44 | F38: 43 | G38: =AVERAGE(C38:F38) -> 50.75 | H38: 9 | I38: =SUM(G38:H38) -> 59.75 | J38: 0 | K38: 0 | L38: 4 | M38: =SUM(I38:L38) -> 63.75
A39: chaos mkII | B39: CPi | C39: 37 | D39: 57 | E39: 43 | F39: 39 | G39: =AVERAGE(C39:F39) -> 44 | H39: 9 | I39: =SUM(G39:H39) -> 53 | J39: 0 | K39: 5 | L39: 0 | M39: =SUM(I39:L39) -> 58
A40: Do Wah Diddy | B40: Tekara Asagiri | C40: 43 | D40: 47 | E40: 46 | F40: 42 | G40: =AVERAGE(C40:F40) -> 44.5 | H40: 8 | I40: =SUM(G40:H40) -> 52.5 | J40: 0 | K40: 5 | L40: 0 | M40: =SUM(I40:L40) -> 57.5
A41: Jakkety Sax (The Benny Hill Theme) | B41: Simon X | C41: 48 | D41: 36 | E41: 34 | F41: 35 | G41: =AVERAGE(C41:F41) -> 38.25 | H41: 10 | I41: =SUM(G41:H41) -> 48.25 | J41: 0 | K41: 5 | L41: 1 | M41: =SUM(I41:L41) -> 54.25
A42: Death Machine | B42: Shadowman | C42: 26 | D42: 37 | E42: 31 | F42: 32 | G42: =AVERAGE(C42:F42) -> 31.5 | H42: 9 | I42: =SUM(G42:H42) -> 40.5 | J42: 0 | K42: 5 | L42: 3 | M42: =SUM(I42:L42) -> 48.5
A43: GO!!! ~NARUTO OPENING MIX~ | B43: DRM3 | C43: 29 | D43: 26 | E43: 28 | F43: 36 | G43: =AVERAGE(C43:F43) -> 29.75 | H43: 7 | I43: =SUM(G43:H43) -> 36.75 | J43: 0 | K43: 5 | L43: 2 | M43: =SUM(I43:L43) -> 43.75
A44: DNA | B44: klonoa-3663 | C44: 44 | D44: 61 | E44: 43 | F44: 34 | G44: =AVERAGE(C44:F44) -> 45.5 | H44: 9 | I44: =SUM(G44:H44) -> 54.5 | J44: 0 | K44: -20 | L44: 8 | M44: =SUM(I44:L44) -> 42.5
A45: Battle Without Honor Or Humaity | B45: Sambo | C45: 18 | D45: 28 | E45: 13 | F45: 7 | G45: =AVERAGE(C45:F45) -> 16.5 | H45: 8 | I45: =SUM(G45:H45) -> 24.5 | J45: 0 | K45: 1 | L45: 3 | M45: =SUM(I45:L45) -> 28.5
A46: Heart of Sword (B.D. Remix) | B46: Whatisthematrix | C46: 25 | D46: 23 | E46: 24 | F46: 20 | G46: =AVERAGE(C46:F46) -> 23 | H46: 6 | I46: =SUM(G46:H46) -> 29 | J46: 0 | K46: -20 | L46: 0 | M46: =SUM(I46:L46) -> 9